PubmedID,Title,Publication Date,Non-academic Author(s),Company Affiliation(s),Corresponding Author Email
40671124,Martinostat as a novel HDAC inhibitor to overcome tyrosine kinase inhibitor resistance in chronic myeloid leukemia.,2025-Jul-16,"Christo Christov, Dag Erlend Olberg","Service d'Histologie, Faculté de Médicine, Université de Lorraine, INSERM U1256 NGERE, 54000, Nancy, France., Norsk Medisinsk Syklotronsenter AS, Postboks 4950, 0424, Nydalen, Oslo, Norway.",marcdiederich@snu.ac.kr.
40660195,Advancing prostate cancer research: an exploration of periprostatic adipose stem cells.,2025-Jul-14,"Paula Alejandra Sacca, Juan Carlos Calvo","Instituto de Biología y Medicina Experimental (IBYME), Consejo Nacional de Investigaciones Científicas y Técnicas (CONICET), Vuelta de Obligado 2490, C1428ADN, Buenos Aires, Argentina. psacca@ibyme.conicet.gov.ar., Instituto de Biología y Medicina Experimental (IBYME), Consejo Nacional de Investigaciones Científicas y Técnicas (CONICET), Vuelta de Obligado 2490, C1428ADN, Buenos Aires, Argentina.",psacca@ibyme.conicet.gov.ar.
40659448,T cell-specific non-viral DNA delivery and in vivo CAR-T generation using targeted lipid nanoparticles.,2025-Jul-13,"Jaime Fernández Bimbo, Eline van Diest, Daniel E Murphy, Ator Ashoti, Martijn J W Evers, Suneel A Narayanavari, Diana Pereira Vaz, Hanneke Rijssemus, Christina Zotou, Zhiyong Lei, Peter Mayrhofer, Maurits Geerlings, Raymond Schiffelers, Jacek Lubelski","R&D, NanoCell Therapeutics BV, Utrecht, Utrecht, Netherlands., R&D, NanoCell Therapeutics BV, Utrecht, Utrecht, Netherlands., R&D, NanoCell Therapeutics BV, Utrecht, Utrecht, Netherlands., R&D, NanoCell Therapeutics BV, Utrecht, Utrecht, Netherlands., R&D, NanoCell Therapeutics BV, Utrecht, Utrecht, Netherlands., R&D, NanoCell Therapeutics BV, Utrecht, Utrecht, Netherlands., R&D, NanoCell Therapeutics BV, Utrecht, Utrecht, Netherlands., R&D, NanoCell Therapeutics BV, Utrecht, Utrecht, Netherlands., R&D, NanoCell Therapeutics BV, Utrecht, Utrecht, Netherlands., R&D, NanoCell Therapeutics BV, Utrecht, Utrecht, Netherlands., R&D, NanoCell Therapeutics, Wayne, Pennsylvania, USA., R&D, NanoCell Therapeutics, Wayne, Pennsylvania, USA., R&D, NanoCell Therapeutics BV, Utrecht, Utrecht, Netherlands., R&D, NanoCell Therapeutics BV, Utrecht, Utrecht, Netherlands jlubelski@nanocelltx.com.",jlubelski@nanocelltx.com.
40652522,"Localized Delivery of the mRNAs Encoding CD47 Inhibitor and Interleukins 12, 15, and 21 Elicits Robust Antitumor Immunity.",2025-Jul-13,Xuanrui Zhong,"Shenzhen Maternity & Child Healthcare Hospital, Shenzhen, 518017, China.",
40650023,Clinical and Transcriptomic Characterization of Metastatic Hormone-Sensitive Prostate Cancer Patients with Low PTEN Expression.,2025-Jun-28,"Mariana Altamirano, Albert Font, Alejo Rodriguez-Vida, Miguel Ángel Climent, Sara Cros, Mariona Figols, Núria Sala-González, Vicenç Ruiz de Porras, Juan Carlos Pardo","Medical Oncology Department, Hospital Clínic, 08036 Barcelona, Spain., Medical Oncology Department, Institut Català d'Oncologia, Hospital Germans Trias i Pujol, 08916 Badalona, Spain., Medical Oncology Department, Hospital del Mar, 08003 Barcelona, Spain., Medical Oncology Service, Instituto Valenciano de Oncología (IVO), 46009 Valencia, Spain., Medical Oncology Department, Hospital General de Granollers, 08402 Barcelona, Spain., Medical Oncology Department, Fundació Althaia, Xarxa Assistencial Universitària de Manresa, 08242 Manresa, Spain., Department of Medical Oncology, Institut Català d'Oncologia, 17007 Girona, Spain., Badalona Applied Research Group in Oncology (B-ARGO), Institut Català d'Oncologia, 08916 Germans Trias i Pujol Badalona, Spain., Medical Oncology Department, Institut Català d'Oncologia, Hospital Germans Trias i Pujol, 08916 Badalona, Spain.",
40643795,Generation of NOD SCID mice with near-complete deletions of Il2rg and Prkdc for human cancer and HSC engraftment.,2025-Jul-11,"Tae Wook Nam, Mi Yeon Park, Sun Ha Park, Sung Joo Kim","GEMCRO, Inc., Seoul, 03722, Republic of Korea., GEMCRO, Inc., Seoul, 03722, Republic of Korea., GEMCRO, Inc., Seoul, 03722, Republic of Korea., Jeju Halla Hospital, Jeju-si, Jeju-do, 63127, Republic of Korea.",choi79@skku.edu.
40643531,Ciprofloxacin Exerts Anti-Tumor Effects In Vivo Through cGAS-STING Activation and Modulates Tumor Microenvironment.,2025-Jul-02,"Chih-Wen Chi, Cheng-Ta Lai, Shu-Hua Wu, Hui-Ru Shieh, Yu-Jen Chen","Department of Medical Research, MacKay Memorial Hospital, New Taipei City 251020, Taiwan., Division of Colon and Rectal Surgery, Department of Surgery, MacKay Memorial Hospital, Taipei 104217, Taiwan., Department of Medical Research, MacKay Memorial Hospital, New Taipei City 251020, Taiwan., Department of Medical Research, MacKay Memorial Hospital, New Taipei City 251020, Taiwan., Department of Medical Research, MacKay Memorial Hospital, New Taipei City 251020, Taiwan.",
40643466,Novel In Vitro Selection of ,2025-Jun-20,Swapnil Sinha,"IIT Guwahati TIDF BioNest, Guwahati 70005, India.",
40642068,The influence of ,2025,"Valli De Re, Mariateresa Casarotto, Giulia Brisotto, Stefania Zanussi, Mariangela De Zorzi, Ombretta Repetto, Elena Muraro, Paola Spessotto, Paolo Baldo, Agostino Steffan, Stefano Realdon, Renato Cannizzaro","Immunopathology and Cancer Biomarkers Unit, Centro di Riferimento Oncologico di Aviano (CRO), IRCCS, Aviano, Italy., Immunopathology and Cancer Biomarkers Unit, Centro di Riferimento Oncologico di Aviano (CRO), IRCCS, Aviano, Italy., Immunopathology and Cancer Biomarkers Unit, Centro di Riferimento Oncologico di Aviano (CRO), IRCCS, Aviano, Italy., Immunopathology and Cancer Biomarkers Unit, Centro di Riferimento Oncologico di Aviano (CRO), IRCCS, Aviano, Italy., Immunopathology and Cancer Biomarkers Unit, Centro di Riferimento Oncologico di Aviano (CRO), IRCCS, Aviano, Italy., Immunopathology and Cancer Biomarkers Unit, Centro di Riferimento Oncologico di Aviano (CRO), IRCCS, Aviano, Italy., Immunopathology and Cancer Biomarkers Unit, Centro di Riferimento Oncologico di Aviano (CRO), IRCCS, Aviano, Italy., Molecular Oncology Unit, Centro di Riferimento Oncologico Aviano, (CRO) IRCCS, Aviano, Italy., Pharmacy Unit, Centro di Riferimento Oncologico di Aviano (CRO), IRCCS, Aviano, Italy., Immunopathology and Cancer Biomarkers Unit, Centro di Riferimento Oncologico di Aviano (CRO), IRCCS, Aviano, Italy., Division of Oncological Gastroenterology, Centro di Riferimento Oncologico di Aviano (CRO) IRCCS, Aviano, Italy., Division of Oncological Gastroenterology, Centro di Riferimento Oncologico di Aviano (CRO) IRCCS, Aviano, Italy.",
40639775,Drug Repurposing Targeting miRNA-mRNA Networks to Mitigate Areca Nut-Induced Head and Neck Cancer.,2025-Jul-08,Yu-Chen Huang,"Department of Oral and Maxillofacial Surgery, Linkou Chang Gung Memorial Hospital, Taoyuan 333423, Taiwan.",annjoycheng@gap.cgu.edu.tw.
40633772,Low-frequency ultrasound-mediated blood-brain barrier opening enables non-invasive lipid nanoparticle RNA delivery to glioblastoma.,2025-Jul-07,Dana Bar-On,"Teva Pharmaceutical Industries, Netanya, Israel.",ilovitsh@tauex.tau.ac.il.
40626151,The oncogenic role of SPOCK1 in lung carcinoma by promoting immune evasion and its related mechanisms.,2025-Aug,"Juan Chen, Dan Wei, Wenzhe Zhang, Wanhui Xie","Department of Respiratory Medicine, No. 215 Hospital of Shaanxi Nuclear Industry, Xianyang, China., Department of Respiratory Medicine, No. 215 Hospital of Shaanxi Nuclear Industry, Xianyang, China., Department of Respiratory Medicine, No. 215 Hospital of Shaanxi Nuclear Industry, Xianyang, China., Department of Respiratory Medicine, No. 215 Hospital of Shaanxi Nuclear Industry, Xianyang, China.",
40619794,Current Anti-Myeloma Chimeric Antigen Receptor-T Cells: Novel Targets and Methods.,2025-Jul-01,"Ece Vural, Meral Beksaç","Clinic of Hematology, Ankara Liv Hospital, Ankara, Türkiye., Clinic of Hematology, Ankara Liv Hospital, Ankara, Türkiye.",
40616731,Attenuation of brucine action on DMBA/TPA-induced skin cancer by PI3K/Akt/mTOR signaling.,2025-Jul-05,"Ao Huang, Lian Zhang, Hong Luo","Department of Skin STD, The First Hospital of Changsha, Hunan Province, Changsha, 410000, China., Department of Skin STD, The Third People's Hospital of Shenzhen, Shenzhen, 518000, China., Department of Skin STD, The Third People's Hospital of Shenzhen, Shenzhen, 518000, China. lh3602677@sina.com.",YYXiao301hBJ@yeah.net.
40615369,Targeting the ROCK2/UBA52/DRP1 axis enhances ferroptosis and overcomes pemigatinib resistance in Cholangiocarcinoma.,2025-Jul-04,"Bolin Zhang, Shouhua Zhang, Wei Zhou","Department of Abdominal Surgery, Jiangxi Cancer Hospital, Nanchang, China., Department of General Surgery, Jiangxi Children's Hospital, Nanchang, Jiangxi Province, China., Department of Abdominal Surgery, Jiangxi Cancer Hospital, Nanchang, China. doctorfdzw@163.com.",18770099029@126.com.
40613352,Nanobody-Decorated Lipid Nanoparticles for Enhanced mRNA Delivery to Tumors In Vivo.,2025-Jul-04,"Vincenzo Verdi, Guido Jenster, Wytske M van Weerden, Guillaume van Niel","Institut de Psychiatrie et Neurosciences de Paris, Université Paris Cité, INSERM 1266, Paris, 75014, France., Department of Urology, Erasmus MC, Rotterdam, 3015GD, The Netherlands., Department of Urology, Erasmus MC, Rotterdam, 3015GD, The Netherlands., Institut de Psychiatrie et Neurosciences de Paris, Université Paris Cité, INSERM 1266, Paris, 75014, France.",
40613218,Evaluation of HMGB1 as possible marker via breast organoid cultures research.,2025-Sep,"Massimiliano D'Aiuto, Gennaro Mossetti","Clinica Villa Fiorita, I-81031 Aversa, Italy., Pathological Anatomy Service, Maria Rosaria Clinic, Pompei, I-80045 Naples, Italy.",
40606990,Cardiovascular adverse effects of immunotherapy in cancer: insights and implications.,2025,"Haiping Du, Jie Wang, Zhen Wang","Department of Cardiology, Yantaishan Hospital, Yantai, Shandong, China., Department of Cardiac Care Unit, Yantaishan Hospital, Yantai, Shandong, China., Department of Cardiology, Yantaishan Hospital, Yantai, Shandong, China.",
40604818,STK3 is a transcriptional target of YAP1 and a hub component in the crosstalk between Hippo and Wnt signaling pathways during gastric carcinogenesis.,2025-Jul-02,Jianwu Chen,"Department of Burn and Plastic Surgery, General Hospital of Southern Theater Command, PLA, Guangzhou, China.",weikang@cuhk.edu.hk.
40602406,Cardiolipin-mimic lipid nanoparticles without antibody modification delivered senolytic in vivo CAR-T therapy for inflamm-aging.,2025-Jul-15,"Jiang Hu, Xun Gui, Rui Wang, Yun Yang","Shanghai CirCode Biomed Co.,Ltd., Shanghai 200131, China., Mabwell (Shanghai) Bioscience Co., Ltd., Shanghai 201210, China., Mabwell (Shanghai) Bioscience Co., Ltd., Shanghai 201210, China., Shanghai CirCode Biomed Co.,Ltd., Shanghai 200131, China. Electronic address: yangyun@circodebio.com.",yangyun@circodebio.com.
40594966,The mechanism of Bletilla striata inhibiting glioma proliferation through the PI3K/AKT/mTOR signaling pathway based on network Pharmacology analysis.,2025-Jul-01,"Fenglian Ren, Changyang He, Xianmei Zhong","Department of Oncology, Nanbu People's Hospital, Nanbu, 637300, Sichuan, China., Department of Pharmacy, Nanbu People's Hospital, Nanbu, 637300, Sichuan, China., Department of Pharmacy, Nanbu People's Hospital, Nanbu, 637300, Sichuan, China. zhongxiaohaha@126.com.",zhouchunyang@nsmc.edu.cn.
40587726,"Impact of neoadjuvant therapy on cancer stem cell gene expression and miRNA profiles in breast cancer patients: Implications for therapy resistance and survival, a cross-sectional observational study.",2025-Jun-27,Müzeyyen Burcu Kaplan Yilmaz,"Department of Pathology, Abdurrahman Yurtaslan Onkoloji Research and Training Hospital, Ankara, Turkey.",
40581663,Identifying and exploiting combinatorial synthetic lethality by characterizing adaptive kinome rewiring of EGFRvIII-driven glioblastoma.,2025-Jun-28,Jann N Sarkaria,"Department of Radiation Oncology, Mayo Clinic, Rochester, MN, USA.",ryanmiller@uabmc.edu.
40579921,PTBP1 and Cancer: From RNA Regulation to Therapeutic Potential.,2025-Jul,Chengdong Ji,"Pathology Department, The Ninth People's Hospital of Suzhou, Suzhou, China.",
40575485,The oncolytic avian reovirus p17 protein suppresses invadopodia formation via disruption of TKs5 complexes and oncogenic signaling pathways.,2025,"Chao-Yu Hsu, Lon-Fye Lye","Division of Urology, Department of Surgery, Tungs' Taichung MetroHarbor Hospital, Taichung, Taiwan., Department of Medical Research, Tungs' Taichung MetroHarbor Hospital, Taichung, Taiwan.",
40565018,RIPK1 in Diffuse Glioma Pathology: From Prognosis Marker to Potential Therapeutic Target.,2025-Jun-10,"Leslie C Amorós Morales, Santiago M Gómez Bergna, Abril Marchesini, María Luján Scalise, Nazareno Gonzalez, M Leticia Ferrelli, Marianela Candolfi, Víctor Romanowski, Matias L Pidre","Instituto de Biotecnología y Biología Molecular (IBBM, UNLP-CONICET), Facultad de Ciencias Exactas, Universidad Nacional de La Plata, Consejo Nacional de Investigaciones Científicas y Técnicas, La Plata B1900, Argentina., Instituto de Biotecnología y Biología Molecular (IBBM, UNLP-CONICET), Facultad de Ciencias Exactas, Universidad Nacional de La Plata, Consejo Nacional de Investigaciones Científicas y Técnicas, La Plata B1900, Argentina., Instituto de Biotecnología y Biología Molecular (IBBM, UNLP-CONICET), Facultad de Ciencias Exactas, Universidad Nacional de La Plata, Consejo Nacional de Investigaciones Científicas y Técnicas, La Plata B1900, Argentina., Instituto de Biotecnología y Biología Molecular (IBBM, UNLP-CONICET), Facultad de Ciencias Exactas, Universidad Nacional de La Plata, Consejo Nacional de Investigaciones Científicas y Técnicas, La Plata B1900, Argentina., Instituto de Investigaciones Biomédicas (INBIOMED, UBA-CONICET), Facultad de Medicina, Universidad de Buenos Aires, Consejo Nacional de Investigaciones Científicas y Técnicas, Ciudad Autónoma de Buenos Aires C1121ABG, Argentina., Instituto de Biotecnología y Biología Molecular (IBBM, UNLP-CONICET), Facultad de Ciencias Exactas, Universidad Nacional de La Plata, Consejo Nacional de Investigaciones Científicas y Técnicas, La Plata B1900, Argentina., Instituto de Investigaciones Biomédicas (INBIOMED, UBA-CONICET), Facultad de Medicina, Universidad de Buenos Aires, Consejo Nacional de Investigaciones Científicas y Técnicas, Ciudad Autónoma de Buenos Aires C1121ABG, Argentina., Instituto de Biotecnología y Biología Molecular (IBBM, UNLP-CONICET), Facultad de Ciencias Exactas, Universidad Nacional de La Plata, Consejo Nacional de Investigaciones Científicas y Técnicas, La Plata B1900, Argentina., Instituto de Biotecnología y Biología Molecular (IBBM, UNLP-CONICET), Facultad de Ciencias Exactas, Universidad Nacional de La Plata, Consejo Nacional de Investigaciones Científicas y Técnicas, La Plata B1900, Argentina.",
40563598,Periodic Boosters of COVID-19 Vaccines Do Not Affect the Safety and Efficacy of Immune Checkpoint Inhibitors for Advanced Non-Small Cell Lung Cancer: A Longitudinal Analysis of the Vax-On-Third Study.,2025-Jun-11,"Agnese Fabbri, Enzo Maria Ruggeri, Antonella Virtuoso, Diana Giannarelli, Armando Raso, Fabrizio Chegai, Daniele Remotti, Carlo Signorelli, Fabrizio Nelli","Medical Oncology Unit, Department of Oncology and Hematology, Central Hospital of Belcolle, 01100 Viterbo, Italy., Medical Oncology Unit, Department of Oncology and Hematology, Central Hospital of Belcolle, 01100 Viterbo, Italy., Medical Oncology Unit, Department of Oncology and Hematology, Central Hospital of Belcolle, 01100 Viterbo, Italy., Biostatistics Unit, Scientific Directorate, Fondazione Policlinico Universitario A. Gemelli, Istituto di Ricovero e Cura a Carattere Scientifico (IRCCS), 00136 Rome, Italy., Department of Oncology and Hematology, Thoracic and Interventional Radiology, Central Hospital of Belcolle, 01100 Viterbo, Italy., Department of Oncology and Hematology, Thoracic and Interventional Radiology, Central Hospital of Belcolle, 01100 Viterbo, Italy., Pathology Unit, Department of Oncology and Hematology, Central Hospital of Belcolle, 01100 Viterbo, Italy., Medical Oncology Unit, Department of Oncology and Hematology, Central Hospital of Belcolle, 01100 Viterbo, Italy., Medical Oncology Unit, Department of Oncology and Hematology, Central Hospital of Belcolle, 01100 Viterbo, Italy.",
